{
  "version": "1.0",
  "study": {
    "title": "The station letter",
    "purpose": "Explore how readers respond to a chapter excerpt."
  },
  "sources": [
    {
      "path": "chapter-source.md",
      "sha256": "b46ce561b6ae6c8898b58e9882a3f33157685ef288b182a37355ac55509c48bf"
    }
  ],
  "items": [
    { "id": "arrival", "text": "Mara arrived at the station after the last train." },
    { "id": "letter", "text": "The unopened letter carried her brother's seal." },
    { "id": "revelation", "text": "Inside, she learned why he had left the coast." }
  ],
  "decisions": [
    {
      "id": "chapter-pacing",
      "instructions": "Choose how you would respond at this point in the chapter.",
      "criteria": { "continue": "Read the next passage.", "stop": "Stop here." }
    }
  ],
  "nodes": [
    { "id": "show-arrival", "kind": "expose", "itemId": "arrival" },
    { "id": "choose-after-arrival", "kind": "decide", "decisionId": "chapter-pacing" },
    { "id": "show-letter", "kind": "expose", "itemId": "letter" },
    { "id": "choose-after-letter", "kind": "decide", "decisionId": "chapter-pacing" },
    { "id": "show-revelation", "kind": "expose", "itemId": "revelation" },
    { "id": "chapter-ended", "kind": "terminal", "outcome": "chapter-ended" },
    { "id": "stopped", "kind": "terminal", "outcome": "stopped" }
  ],
  "transitions": [
    { "fromNodeId": "show-arrival", "toNodeId": "choose-after-arrival" },
    { "fromNodeId": "choose-after-arrival", "choice": "continue", "toNodeId": "show-letter" },
    { "fromNodeId": "choose-after-arrival", "choice": "stop", "toNodeId": "stopped" },
    { "fromNodeId": "show-letter", "toNodeId": "choose-after-letter" },
    { "fromNodeId": "choose-after-letter", "choice": "continue", "toNodeId": "show-revelation" },
    { "fromNodeId": "choose-after-letter", "choice": "stop", "toNodeId": "stopped" },
    { "fromNodeId": "show-revelation", "toNodeId": "chapter-ended" }
  ],
  "entryNodeId": "show-arrival",
  "maxDecisions": 4
}
